{
  "schemaVersion": "1.4.0",
  "houdiniVersion": "22.0.466",
  "exportedAt": "2026-10-27T09:38:21.289825+00:00",
  "exportMode": "full",
  "icons": {},
  "customShapes": {},
  "root": {
    "path": "/obj/circuit_board",
    "type": "geo",
    "context": "Sop",
    "nodes": [
      {
        "name": "transform1",
        "type": "xform",
        "label": "Transform",
        "icon": "SOP_xform",
        "pos": [
          0.2817,
          -2.0851
        ],
        "size": [
          1.1296,
          0.2824
        ],
        "color": [
          0.8,
          0.8,
          0.8
        ],
        "shape": "rect",
        "flags": {
          "bypass": false,
          "display": false,
          "render": false,
          "template": false,
          "selectableTemplate": false,
          "lock": false,
          "softLock": false
        },
        "maxInputs": 1,
        "inputLabels": [
          "Transform geometry"
        ],
        "maxOutputs": 1,
        "outputLabels": [
          "Output 1"
        ],
        "comment": "",
        "showComment": false,
        "isSubnetwork": false,
        "hdaState": null,
        "parms": [
          {
            "name": "group",
            "label": "Group",
            "type": "String",
            "val": [
              ""
            ],
            "expr": [
              null
            ]
          },
          {
            "name": "grouptype",
            "label": "Group Type",
            "type": "Menu",
            "val": [
              "guess"
            ],
            "expr": [
              null
            ],
            "menuLabel": "Guess from Group"
          },
          {
            "name": "xOrd",
            "label": "Transform Order",
            "type": "Menu",
            "val": [
              "srt"
            ],
            "expr": [
              null
            ],
            "joinNext": "rOrd",
            "menuLabel": "Scale Rot Trans"
          },
          {
            "name": "rOrd",
            "label": "Rotate Order",
            "type": "Menu",
            "val": [
              "xyz"
            ],
            "expr": [
              null
            ],
            "labelHidden": true,
            "menuLabel": "Rx Ry Rz"
          },
          {
            "name": "t",
            "label": "Translate",
            "type": "Float",
            "val": [
              0.0,
              0.0,
              0.0
            ],
            "expr": [
              null,
              null,
              null
            ]
          },
          {
            "name": "r",
            "label": "Rotate",
            "type": "Float",
            "val": [
              0.0,
              0.0,
              0.0
            ],
            "expr": [
              null,
              null,
              null
            ]
          },
          {
            "name": "s",
            "label": "Scale",
            "type": "Float",
            "val": [
              1.0,
              1.0,
              1.0
            ],
            "expr": [
              null,
              null,
              null
            ]
          },
          {
            "name": "shear",
            "label": "Shear",
            "type": "Float",
            "val": [
              0.0,
              0.0,
              0.0
            ],
            "expr": [
              null,
              null,
              null
            ]
          },
          {
            "name": "scale",
            "label": "Uniform Scale",
            "type": "Float",
            "val": [
              1.25
            ],
            "expr": [
              null
            ],
            "changed": [
              true
            ],
            "range": [
              0.0,
              10.0
            ]
          },
          {
            "name": "parmgroup_pivotxform",
            "label": "parmgroup_pivotxform",
            "type": "FolderSet",
            "val": [
              0
            ],
            "expr": [
              null
            ]
          },
          {
            "name": "p",
            "label": "Pivot Translate",
            "type": "Float",
            "val": [
              0.0,
              0.0,
              0.0
            ],
            "expr": [
              null,
              null,
              null
            ],
            "folders": [
              "Pivot Transform"
            ],
            "folderTypes": [
              "collapsible"
            ]
          },
          {
            "name": "pr",
            "label": "Pivot Rotate",
            "type": "Float",
            "val": [
              0.0,
              0.0,
              0.0
            ],
            "expr": [
              null,
              null,
              null
            ],
            "folders": [
              "Pivot Transform"
            ],
            "folderTypes": [
              "collapsible"
            ]
          },
          {
            "name": "parmgroup_prexform",
            "label": "parmgroup_prexform",
            "type": "FolderSet",
            "val": [
              0
            ],
            "expr": [
              null
            ]
          },
          {
            "name": "prexform_xOrd",
            "label": "Pre-Transform Order",
            "type": "Menu",
            "val": [
              "srt"
            ],
            "expr": [
              null
            ],
            "folders": [
              "Pre-Transform"
            ],
            "folderTypes": [
              "collapsible"
            ],
            "joinNext": "prexform_rOrd",
            "menuLabel": "Scale Rot Trans"
          },
          {
            "name": "prexform_rOrd",
            "label": "Pre-Rotate Order",
            "type": "Menu",
            "val": [
              "xyz"
            ],
            "expr": [
              null
            ],
            "folders": [
              "Pre-Transform"
            ],
            "folderTypes": [
              "collapsible"
            ],
            "labelHidden": true,
            "menuLabel": "Rx Ry Rz"
          },
          {
            "name": "prexform_t",
            "label": "Pre-Translate",
            "type": "Float",
            "val": [
              0.0,
              0.0,
              0.0
            ],
            "expr": [
              null,
              null,
              null
            ],
            "folders": [
              "Pre-Transform"
            ],
            "folderTypes": [
              "collapsible"
            ]
          },
          {
            "name": "prexform_r",
            "label": "Pre-Rotate",
            "type": "Float",
            "val": [
              0.0,
              0.0,
              0.0
            ],
            "expr": [
              null,
              null,
              null
            ],
            "folders": [
              "Pre-Transform"
            ],
            "folderTypes": [
              "collapsible"
            ]
          },
          {
            "name": "prexform_s",
            "label": "Pre-Scale",
            "type": "Float",
            "val": [
              1.0,
              1.0,
              1.0
            ],
            "expr": [
              null,
              null,
              null
            ],
            "folders": [
              "Pre-Transform"
            ],
            "folderTypes": [
              "collapsible"
            ]
          },
          {
            "name": "prexform_shear",
            "label": "Pre-Shear",
            "type": "Float",
            "val": [
              0.0,
              0.0,
              0.0
            ],
            "expr": [
              null,
              null,
              null
            ],
            "folders": [
              "Pre-Transform"
            ],
            "folderTypes": [
              "collapsible"
            ]
          },
          {
            "name": "attribs",
            "label": "Attributes",
            "type": "String",
            "val": [
              "*"
            ],
            "expr": [
              null
            ]
          },
          {
            "name": "updatenmls",
            "label": "Recompute Point Normals",
            "type": "Toggle",
            "val": [
              0
            ],
            "expr": [
              null
            ]
          },
          {
            "name": "updateaffectednmls",
            "label": "Recompute Affected Normals",
            "type": "Toggle",
            "val": [
              1
            ],
            "expr": [
              null
            ]
          },
          {
            "name": "vlength",
            "label": "Preserve Normal Length",
            "type": "Toggle",
            "val": [
              1
            ],
            "expr": [
              null
            ]
          },
          {
            "name": "invertxform",
            "label": "Invert Transformation",
            "type": "Toggle",
            "val": [
              0
            ],
            "expr": [
              null
            ]
          },
          {
            "name": "addattrib",
            "label": "Output Attribute",
            "type": "Toggle",
            "val": [
              0
            ],
            "expr": [
              null
            ],
            "joinNext": "outputattrib",
            "labelHidden": true
          },
          {
            "name": "outputattrib",
            "label": "Output Attribute",
            "type": "String",
            "val": [
              "xform"
            ],
            "expr": [
              null
            ],
            "joinNext": "outputmerge",
            "disabled": true
          },
          {
            "name": "outputmerge",
            "label": "Combine",
            "type": "Menu",
            "val": [
              "post"
            ],
            "expr": [